,county,arock_unit,structure,oper_type,mas_id,region,conc_proc,ore_ctrl,url,model,geometry,discr,dev_stat,other_matl,work_type,mrds_id,dep_type,ref,ylp_ba,site_name,com_type,commod1,prod_size,hrock_unit,arock_type,alteration,score,hrock_type,commod2,yfp_ba,prod_yrs,reporter,orebody_fm,commod3,names,ore,tectonic,gangue,dy_ba
104795,,,,Unknown,,EU,,,https://mrdata.usgs.gov/mrds/show-mrds.php?dep_id=10107473,,POINT (-3.6477 40.22603),,Producer,,,W700955,,"MINING MAGAZINE, JANUARY 1989, P. 48",,Franco Belga Mine,M,Iron,Y,,,,D,,,,,"Beougher, Dee (Spanski, Gregory T.)",,,,,,,
104796,,,"Ebro Basin, Anticlinal Diapir",Unknown,,EU,,,https://mrdata.usgs.gov/mrds/show-mrds.php?dep_id=10107475,,POINT (1.68526 41.91574),,Producer,,Unknown,W700963,,"MINING MAGAZINE, JANUARY 1989, P. 48.AGARD, J., AND EMBERGER, A., 1989, INTRODUCTION TO SOUTHWEST EUROPE, IN DUNNING, F.W., GARRARD, P., HASLAM, H.W., AND IXER, R.A., EDS., MINERAL DEPOSITS OF EUROPE, VOLUME 4/5: SOUTHWEST AND EASTERN EUROPE, WITH ICELAND:  LONDON, THE INSTITUTION OF MINING AND METALLURGY AND THE MIENRALOGICAL SOCIETY, P. 1-36.VAZQUEZ GUZMAN, F., 1989, SPAIN, IN DUNNING, F.W., GARRARD, P., HASLAM, H.W., AND IXER, R.A., EDS., MINERAL DEPOSITS OF EUROPE, VOLUME 4/5: SOUTHWEST AND EASTERN EUROPE, WITH ICELAND:  LONDON, THE INSTITUTION OF MINING AND METALLURGY AND THE MIENRALOGICAL SOCIETY, P. 105-196.RAMIREZ ORTEGA, A., 1986, THE CATALAN POTASH FIELD:  INDUSTRIAL MIENRALS, NO. 230, P. 55-59.GRIFFITHS, JOYCE, 1985, SPAIN'S INDUSTRIAL MINERALS:  INDUSTRIAL MINERALS, NO. 217, P. 23-63.VAZQUEZ GUZMAN, 1989.",,Cardona,N,Potassium,Y,Cardona Formation,,,B,"Shale,Sandstone,Evaporite",Halite,,,"Beougher, Dee (Spanski, Gregory T.), Orris, Greta J.",,,Minas De Cardona,"Carnallite, Halite",,,
104797,,,,Unknown,,EU,,,https://mrdata.usgs.gov/mrds/show-mrds.php?dep_id=10107476,,POINT (-3.6477 40.22603),,Producer,,,W700968,,"MINING MAGAZINE, JANUARY 1989, P. 48",,Aznalcollor Mine,M,"Silver, Lead, Copper, Zinc",Y,,,,D,,,,,"Beougher, Dee (Spanski, Gregory T.)",,,,,,,
104798,,,,Unknown,,EU,,,https://mrdata.usgs.gov/mrds/show-mrds.php?dep_id=10107477,,POINT (-3.6477 40.22603),,Producer,,,W700972,,"MINING MAGAZINE, JANUARY 1989, P. 48",,Rubiales Mine,M,"Silver, Lead, Zinc",Y,,,,D,,,,,"Beougher, Dee (Spanski, Gregory T.)",,,,,,,
107489,,,,Unknown,,EU,,,https://mrdata.usgs.gov/mrds/show-mrds.php?dep_id=10110377,,POINT (-3.6477 40.22603),,Producer,,,W001952,,"FONT-ALTABA, M., AND J. CLOSAS, M.A., 1960, A BAUXITE DEPOSIT IN THE PALEOZOIC OF LEON, SPAIN:  ECON. GEOL., V. 55, NO. 6, PP. 1285-1290.MIRALLES, J.C., 1954, LAS BAUXITAS DEL N.E. DE ESPANA; INTERNAT. GEOL. CONG., 19TH, ALGIERS 1952, COMPTES RENDUS, NO. 12, PP. 199-223.RIOS, J.M., AND ALMELA, A., 1950, DESCUBRIMIENTO DE UNA NUEVA ZONA BAUXITIFERA EN CATALUNA:  SPAIN, INST. GEOLOGICO Y MINERO, NOTAS Y COMUNICACIONES, NO. 20, PP. 179-186.",,Bauxite - Spain,M,Aluminum,Y,,,,D,,,,,"Bannigan, Jane L.",,,,Bauxite,,,
107627,,,,Unknown,,EU,,,https://mrdata.usgs.gov/mrds/show-mrds.php?dep_id=10110552,,POINT (-4.11484 38.68259),,Producer,,,W018813,,E/MJ INTL. DIR,,Diogenes Mine,M,Lead,S,,,,D,,,,,"Schruben, Paul G.",,,,,,,
108485,,,,Unknown,,EU,,,https://mrdata.usgs.gov/mrds/show-mrds.php?dep_id=10111415,"112: Bauxite, karst type",POINT (-3.6477 40.22603),,Unknown,,,DE03004,Residual,U.S. BUREAU OF MINES MINERALS YEARBOOK 1954,,Catalonia,M,Aluminum,U,,,,D,,,,,"Mosier, Dan",,,,,,,
115503,,,,Underground,4690450004,EU,,,https://mrdata.usgs.gov/mrds/show-mrds.php?dep_id=10118542,,POINT (-3.49818 38.09927),,Past Producer,"Calcite, Galena, Silver",Underground,,,,,Linaresel Cobre,M,Lead,,,,,E,,Silver,,,"Difrancesco, Carl A.",,,"Mina Linares, El Cobre",,,,
130262,,,,Underground,4690290002,EU,,,https://mrdata.usgs.gov/mrds/show-mrds.php?dep_id=10133759,,POINT (-8.86479 42.71593),,Producer,"Cassiterite, Molybdenite, Wolframite",Underground,,,"PLAN DE LABORES PARA EL ANO 1981:  MINISTERIO DE INDUSTRIAY ENERGIA, ESPANA.POSSIBILIDADES DE EXPLOTACION DE LOS RECURSOS DE ESTANO-WOLFRAMIO-MOLIBDENS EN MINERALIZACIONES FILONIANAS,TIPO SAN FINX;  PUBLISHED REPORT, MADRID, DECEMBER 1981",,San Finx,M,"Tungsten, Tin",,,,,D,,,,,Eastern Field Operations Center (EFOC),,,,,,,
130442,,,,Surface-Underground,4690590001,EU,,,https://mrdata.usgs.gov/mrds/show-mrds.php?dep_id=10133953,,POINT (-0.75819 37.59924),,Producer,,,,,"WORLD MINES REGISTER 1976-77 P156WORLD MINING, JULY 1967, PENARROYA STRIPS SPANISH MOUNTAIN TNEW PB-ZN-AG OPEN PIT MINE P 16",,Penarroya,M,,,,,,D,,,,,"West, B.J.",,"Lead, Silver, Zinc",,,,,
130471,,,,Surface,4690290001,EU,,,https://mrdata.usgs.gov/mrds/show-mrds.php?dep_id=10133985,,POINT (-8.32809 42.51922),,Past Producer,"Chalcopyrite, Chlorite, Garnet, Pyrite, Pyrrhotite",Surface,,,"E/MJ JUNE 1977, P 133WORLD MINES REGISTER 1976-77, P 157E/MJ INTERNATIONAL DIRECTORY, 1976, P. 285.RIO TINTO PATINO ANNUAL REPORT 1977.",,Santiago,M,Copper,,,,,B,,,,,Dab / Golder,,"Silver, Gold",Santiago Mine,,,,
130507,,,,Underground,4690590005,EU,,,https://mrdata.usgs.gov/mrds/show-mrds.php?dep_id=10134023,,POINT (-0.98149 37.59924),,Producer,,,,,"DENVER LISTING, 1975, P. 88, 93.ENGINEERING AND MINING JOURNAL INTERNATIONAL DIRECTORY OFMINING AND MINERAL PROCESSING OPERATIONS, MCGRAW-HILL,1978, P.347",,Celdran Mine,M,"Lead, Zinc",,,,,D,,Iron,,,"Ewu, Chiang",,Sulfur-Pyrite,,,,,
130590,,,,Surface-Underground,4690730001,EU,,,https://mrdata.usgs.gov/mrds/show-mrds.php?dep_id=10134109,,POINT (-4.08134 43.33243),,Producer,"Calcite, Cerussite, Galena, Goethite, Grossularite, Limonite, Marcasite, Melanterite, Pyrite, Smithsonite, Sphalerite","Surface, Underground",,,"PA&H REPORT, 1987MINING MAGAZINE, AUGUST 1989, PP. 102-116",,Reocin,B,"Lead, Zinc",,,,,B,,Sulfur,,,"Difrancesco, Carl A.",,,Minas De Reocin,,,,
130623,,,,Processing Plant,4690671001,EU,,,https://mrdata.usgs.gov/mrds/show-mrds.php?dep_id=10134142,,POINT (-4.53141 41.0159),,Plant,,,,,,,(Facility) Palencia Copper Smelter,M,Copper,,,,,E,,,,,Unknown,,,,,,,
130654,,,,Underground,4690530001,EU,,,https://mrdata.usgs.gov/mrds/show-mrds.php?dep_id=10134173,,POINT (-7.03137 42.7325),,Past Producer,,Underground,,,"NEW LEAD-ZINC PRODUCER FOR SPAIN, MINING MAGAZINE, OCT 1974PINCOCK, ALLEN & HOLT REPORT, 1987E&MJ INTERNATIONAL DIRECTORY OF MINING, 1991",,Rubiales Mine,M,"Lead, Zinc",,,,,C,,Silver,,,"Difrancesco, Carl A.",,,,,,,
130671,,,,Processing Plant,4690731001,EU,,,https://mrdata.usgs.gov/mrds/show-mrds.php?dep_id=10134190,,POINT (-2.99804 42.99913),,Plant,,,,,,,(Facility) Santander Smelter,M,"Chromium, Ferrochrome",,,,,E,,,,,Unknown,,,,,,,
130723,,,,Surface,4690110002,EU,,,https://mrdata.usgs.gov/mrds/show-mrds.php?dep_id=10134244,,POINT (-6.89818 39.06599),,Producer,"Arsenopyrite, Cassiterite, Scheelite, Sphalerite, Wolframite",Surface,,,"CHRONIQUE DE LA RECHERCHE MINIERE, 1981, NO. 463, P. 17-22.GUMIEL, P., AND PINEDA, A., ESTUDIO DEL YACIMIENTO DESCHEELITE DE LA PARILLA, TECNITERRAE, P., 5-259.PLAN NACIONAL DE MINIERIS, MINISTERIO DE INDUSTRIA JENERGIA, DESCRIPTION DE LA PARILLA.",,La Parilla,M,Tungsten,,,,,C,,Tin,,,Rfb,,,,,,,
130793,,,,Processing Plant,4690001001,EU,,,https://mrdata.usgs.gov/mrds/show-mrds.php?dep_id=10134314,,POINT (-3.68142 40.4159),,Producer,,,,,,,Ferro Electro Oper,M,Iron,,,,,E,,Manganese,,,Unknown,,,,,,,
130828,,,,Processing Plant,4690152106,EU,,,https://mrdata.usgs.gov/mrds/show-mrds.php?dep_id=10134351,,POINT (1.68523 41.91577),,Producer,,,,,,,Cardona Operations,N,Potassium,,,,,E,,,,,Zimbelman,,,,,,,
130841,,,,Underground,4690390001,EU,,,https://mrdata.usgs.gov/mrds/show-mrds.php?dep_id=10134365,,POINT (-2.18134 43.04911),,Producer,"Galena, Sphalerite",Underground,,,"PINCOCK, ALLEN & HOLT REPORT, 1987*CRU QUARTERLY MARKET SERVICE, ZINC, JAN. 1994, P. 41.",,La Troya,M,"Lead, Zinc",,,,,C,,,,,"Difrancesco, Carl A.",,,,,,,
153848,,,,Processing Plant,4690891016,EU,,,https://mrdata.usgs.gov/mrds/show-mrds.php?dep_id=10157922,,POINT (-4.74809 41.64918),,Producer,,,,,,,Valladolid,M,Aluminum,,,,,E,,,,,Unknown,,,,,,,
153862,,,,Underground,4690450005,EU,,,https://mrdata.usgs.gov/mrds/show-mrds.php?dep_id=10157936,,POINT (-3.78149 37.76598),,Producer,,,,,"MINING MAGAZINE, MINING ACTIVITY-1968, SEPT. 1969, V. 121,NO. 3, P. 245.DENVER LISTING, 1975, P. 84.",,Grupo Cobo,M,"Lead, Silver",,,,,D,,,,,"Ewu, Chiang",,,Grupo Cabo Jaen,,,,
153869,,,,Surface-Underground,4690650002,EU,,,https://mrdata.usgs.gov/mrds/show-mrds.php?dep_id=10157943,,POINT (-5.49804 43.41586),,Past Producer,,"Surface, Underground",,,"PRIVATE PUBLICATION, UNIVERSITY OF MADRID, SCHOOL OF MININGENGINEERING AND GEOLOGY, MADRID, SPAIN, 1982.",,Fluoruros S.A.,N,,,,,,B,,,,,"Kilgore, Catherine C.",,Fluorine-Fluorite,"Fluoruros, S.A.",,,,
153997,,,,Processing Plant,4690672001,EU,,,https://mrdata.usgs.gov/mrds/show-mrds.php?dep_id=10182162,,POINT (-4.53141 41.0159),,Plant,,,,,,,(Facility) Palencia Copper Refinery,M,Copper,,,,,E,,,,,Unknown,,,,,,,
154000,,,,Surface-Underground,4690410009,EU,,,https://mrdata.usgs.gov/mrds/show-mrds.php?dep_id=10158079,,POINT (-6.60101 37.68573),,Plant,"Chalcocite, Chalcopyrite, Pyrite","Surface, Underground",,,"BRITISH SULPHUR CORP. LTD., ""WORLD SURVEY OF SULPHURRESOURCES"", THIRD EDITION, 1985.",,Corta Atalaya/Alfredo Pyrite,B,Sulfur,,,,,B,,"Zinc, Lead, Copper",,,"Buckingham, David A.",,"Silver, Gold","Cerro Colorado - Corta Atalaya, San Dionisio Orebody",,,,
154117,,,,Underground,4690150002,EU,,,https://mrdata.usgs.gov/mrds/show-mrds.php?dep_id=10158197,,POINT (1.08193 41.80908),,Plant,"Anhydrite, Carnallite, Halite, Sylvanite",Underground,,,"CHADWICK, JOHN R.,""ERT POTASAS DEL LLOBREGAT- SPAIN'SMAJOR POTASH PRODUCER "" ARTICLE IN WORLD MINING, MARCH 1980,PP. 56-59.MINISTRY OF INDUSTRY AND ENERGY, 1981 SPANISH MININGSTATISTICS, MADRID SPAIN, 1982.",,Llobregat,N,Potassium,,,,,B,,,,,"Buckingham, David A.",,,Potasasde Llobregat,,,,
177569,,,,Underground,4690070001.0,EU,,,https://mrdata.usgs.gov/mrds/show-mrds.php?dep_id=10182210,,POINT (-2.94821 36.8493),,Producer,,,,,WORLD MINES REGISTER 1976-77 P. 155.,,Berja Mine,M,,,,,,D,,,,,"West, B.J.",,Lead,,,,,
177581,,,,Processing Plant,4690591046.0,EU,,,https://mrdata.usgs.gov/mrds/show-mrds.php?dep_id=10182222,,POINT (-0.98149 37.59924),,Producer,,,,,,,Santa-Lucia Smelting Works,M,Lead,,,,,E,,,,,Zimbelman,,,,,,,
177745,,,,Surface,4690650003.0,EU,,,https://mrdata.usgs.gov/mrds/show-mrds.php?dep_id=10182397,,POINT (-5.83135 43.34916),,Prospect,,,,,,,Salave,M,Gold,,,,,E,,,,,Unknown,,,,,,,
177855,,,,Surface,4690910001.0,EU,,,https://mrdata.usgs.gov/mrds/show-mrds.php?dep_id=10182512,,POINT (-2.92804 43.24912),,Producer,,,,,"MINING MAGAZINE SEPT 1976, TABLE B-1126 MINES ACCOUNTING FORALL OUTPUT OTHER COAL",,Abandonada,M,,,,,,D,,,,,"West, B.J.",,Iron,,,,,
177947,,,,Underground,4690150004.0,EU,,,https://mrdata.usgs.gov/mrds/show-mrds.php?dep_id=10182608,,POINT (1.85413 41.85127),,Plant,,,,,,,Balsareny/Sallent,N,Potassium,,,,,E,,,,,"Buckingham, David A.",,,,,,,
178033,,,,Surface-Underground,4690410008.0,EU,,,https://mrdata.usgs.gov/mrds/show-mrds.php?dep_id=10182694,,POINT (-6.18821 37.57932),,Producer,,,,,"WORLD MINES REGISTER 1976-77, P 155.METALS SOURCE BOOK 12/24/73, ITEM NO (A5410).",,Cala Mines,M,,,,,,D,,,,,"West, B.J",,"Copper, Iron",,,,,
178035,,,,Processing Plant,4690532001.0,EU,,,https://mrdata.usgs.gov/mrds/show-mrds.php?dep_id=10182696,,POINT (-7.51479 42.16592),,Plant,,,,,"ALUMINUM PRODUCTION COST SURVEY, 1980-1985 BROOK HUNT ANDASSOCIATES LTD. PG. 311(RECORDS 1-4,11)ALUMINUM PRODUCTION COST SURVEY, 1988 BROOK HUNT AND ASSOC-IATES LTD. PG.2.39 (RECORDS 5-8,12,13)MBM.  JULY 1991, P. 31.",,San Ciprian,M,Aluminum,,,,,C,,,,,"Wilburn, David R.",,,San Ciprian Refinery,,,,
178058,,,,Underground,4690250003.0,EU,,,https://mrdata.usgs.gov/mrds/show-mrds.php?dep_id=10182719,,POINT (-4.49818 38.46927),,Producer,,"Surface, Underground",,,"WORLD MINES REGISTER 1976-77 P. 155.METALS SOURCEBOOK 12/10/73 ITEM NO. (A5248).WORLD MINING, VOL. 6, NO. 8, JULY 1970, P.4.HOW SPAIN PLANS TO DOUBLE MINE OUTPUT BY 1980, WORLD MININGJUNE 1972.THE MINERAL INDUSTRY OF SPAIN BY SCOTT F. SIBLEY, MINERALSYEARBOOK, VOL III, 1973, P. 796.SILVER STREAMS - THE FABULOUS MERCURY MINES OF ALMADEN,E&MJ, FEBRUARY, 1989.",,Almaden,M,Mercury,,,,,D,,,,,Minerals Availability Field Office (Mafo),,,,,,,
178076,,,,Underground,4690270001.0,EU,,,https://mrdata.usgs.gov/mrds/show-mrds.php?dep_id=10182740,,POINT (-4.96489 38.24928),,Producer,Galena,Underground,,,,,Gullermin/San Fernando Espiel,B,Barium-Barite,,,,,E,,Lead,,,"Hite, Alan G.",,,"Guillermin and San Fernando Mines, Guillermin Mine, San Fernando No 5 Mine, San Fernando No 6 Mine, Cordoba Mines Group",,,,
178158,,,,Surface,4690070002.0,EU,,,https://mrdata.usgs.gov/mrds/show-mrds.php?dep_id=10182825,,POINT (-2.43151 36.83259),,Prospect,,,,,,,La Mezquita,M,Gold,,,,,E,,,,,Unknown,,,,,,,
178224,,,,Processing Plant,4690911002.0,EU,,,https://mrdata.usgs.gov/mrds/show-mrds.php?dep_id=10182893,,POINT (-2.69803 43.36581),,Plant,,,,,,,Axpeasua,M,Zinc,,,,,E,,,,,Unknown,,,Axpe,,,,
178650,,,,Underground,4690550001.0,EU,,,https://mrdata.usgs.gov/mrds/show-mrds.php?dep_id=10183330,,POINT (-3.42813 40.2492),,Producer,,,,,WORLD MINES REGISTER 1976-77 P. 156,,Cofomin,M,Mercury,,,,,D,,,,,Minerals Availability Field Office (Mafo),,,,,,,
179130,,,,Surface,4690710002.0,EU,,,https://mrdata.usgs.gov/mrds/show-mrds.php?dep_id=10183827,,POINT (-6.51482 41.13253),,Producer,"Cassiterite, Gold, Molybdenite, Scheelite, Wolframite",Surface,,,"C BENEFITS OF SINKING ANDN DEPOSIT AND COTO MINERO MERLADET,S.A. SALAMANCA (SPAIN), ABDONMERLA, BILBAO, SPAINYOCIMIENTOS DE TUNGSTENS J METALES ASOCIADOS DE EUROPAOCCIDENTAL, BOLETIN GEOLOGICO J MENERO, T. XCI-II, 1980(391-416), P.K. DUONG AND OTHERS.ESTUDIO BASICO DE LOS JACIMIENTOS DE VOLFRAMIO TIPO-BARRUECOPARDO, PLAN NACIONAL DE MINERIA.PRIMARY TUNGSTEN ASSOCIATION, BULLETIN NO. 15, JUNE 1982.PLAN DE LABORES PARA EL ANO 1981, MINISTERIO DE INDUSTRIAJ ENERGIA.",,Barruecopardo,M,Tungsten,,,,,B,,,,,Rfb,,,,,,,
179603,,,,Underground,4690150003.0,EU,,,https://mrdata.usgs.gov/mrds/show-mrds.php?dep_id=10184313,,POINT (1.50192 41.66578),,Producer,"Anhydrite, Carnallite, Gypsum, Halite, Sylvanite",Underground,,,"ADAMS, S.S., POTASH, INDUSTRIAL MINERALS AND ROCKS, AIME,1975.BRITISH SULPHUR CORP., WORLD SURVEY OF POTASH RESOURCES,1979, P. 89-92.BRITISH SULPHUR, SPAIN, P&K NO. 123, JANUARY/FEBRUARY1983, P.24.INDUSTRIAL MINERALS,""POTASH- OPTIMISM PREVAILS DESPITEMARKET GLOOM"", MAY, 1982, P.45.INSTITUTO GEOLOGICO Y MINERO DE ESPANA, MONOGRAFIAS DESUSTANICIAS MINERALES, SALES POTASICAS, 1977, 94 PAGES.MINISTERIO DE ECONOMIA Y COMERCIO, BOLETIN DE ESTADISTICA#437, 1982, P.8 AND 9.MINISTERIO DE INDUSTRIA Y ENERGIA, ESTADISTICA MINERIA DEESPANA, 1981.",,Suria,N,Potassium,,,,,B,,,,,"Michael, Mark R.",,,Minas De Potasa De Suria,,,,
201388,,,,Processing Plant,4690891001,EU,,,https://mrdata.usgs.gov/mrds/show-mrds.php?dep_id=10206648,,POINT (-4.9148 41.2992),,Plant,,,,,,,(Facility) Medina Del Campo Smelter,M,"Chromium, Ferrochrome",,,,,E,,,,,"Boyle, Ed",,,Medina Del Campo,,,,
201523,,,,Processing Plant,4690412001,EU,,,https://mrdata.usgs.gov/mrds/show-mrds.php?dep_id=10206788,,POINT (-6.93152 37.24935),,Plant,,,,,"PINCOCK, ALLEN & HOLT, INC.; THE DEVELOPMENT OF ENGINEERING,OPERATING AND ENVIRONMENTAL COST DATA FOR INTERNATIONALCOPPER SMELTING AND REFINING OPERATIONS - HUELVA, SPAIN.BUMINES CONTRACT J0290007; FOR INF. CONTACT S.W. TOWLE,TPO, BUMINES-MAFO, DENVER, CO.",,(Facility) Huelva Copper Refinery,M,Copper,,,,,D,,,,,"Towle, Stewart W.",,,,,,,
201570,,,,Processing Plant,4690591027,EU,,,https://mrdata.usgs.gov/mrds/show-mrds.php?dep_id=10206836,,POINT (-0.98149 37.59924),,Plant,,,,,,,Cartagenazn,M,"Zinc, Refiner",,,,,E,,,,,"Difrancesco, Carl A.",,,Cartagena,,,,
201600,,,,Unknown,4690000004,EU,,,https://mrdata.usgs.gov/mrds/show-mrds.php?dep_id=10206864,,POINT (-1.49811 40.73245),,Prospect,,,,,"ENGINEERING AND MINING JOURNAL, 1978 SURVEY OF MINE ANDPLANT EXPANSION, JAN. 1978, P. 73.",,Ojos Negros,M,Iron,,,,,D,,,,,Robinowewu,,,,,,,
201626,,,,Underground,4690290003,EU,,,https://mrdata.usgs.gov/mrds/show-mrds.php?dep_id=10206898,,POINT (-8.49809 42.49923),,Producer,"Arsenopyrite, Cassiterite, Chalcopyrite, Pyrite, Wolframite",Underground,,,"SEMINARIO DUROPEO DEL TUNGSTENO, D. OLECARIO MARTINEZ TORRESLISBOA, MARZO 1982.REPORT ON GRUPO MINERO SANTA COMBA, UNDATED, CONFIDENTIALPLAN NACIONAL DE LA MINERIA, SANTA COMBA.",,Santa Comba,M,Tungsten,,,,,D,,,,,Eastern Field Operations Center (EFOC),,Tin,,,,,
201648,,,,Processing Plant,4690411001,EU,,,https://mrdata.usgs.gov/mrds/show-mrds.php?dep_id=10206919,,POINT (-6.93152 37.24935),,Plant,,,,,"PINCOCK, ALLEN & HOLT, INC,; THE DEVELOPMENT OF ENGINEERING,OPERATING AND ENVIRONMENTAL COST DATA FOR INTERNATIONALCOPPER SMELTING AND REFINING OPERATIONS - HUELVA, SPAIN.BUMINES CONTRACT J029007; FOR INF., CONTACT S.W. TOWLE,TPO, BUMINES-MAFO, DENVER, CO.",,(Facility) Huelva Copper Smelter,B,Copper,,,,,D,,"Sulfur, Sulfuric Acid",,,"Towle, Stewart W.",,,,,,,
201706,,,,Underground,4690910010,EU,,,https://mrdata.usgs.gov/mrds/show-mrds.php?dep_id=10206976,,POINT (-2.16474 43.16581),,Producer,,,,,"DENVER LISTING, 1975, P. 83, 89.NIGHTINGALE, WM. G., MINING INTERNATIONAL YEARBOOK,THE FINANCIAL TIMES LIMITED, 1978, P. 114.",,Guipozca,M,"Zinc, Lead, Silver",,,,,D,,,,,"Ewu, Chiang",,,"Guipozcoa, Guipuzcoa",,,,
201722,,,,Underground,4690410006,EU,,,https://mrdata.usgs.gov/mrds/show-mrds.php?dep_id=10206993,,POINT (-6.52822 37.39934),,Producer,"Chalcopyrite, Chlorite, Galena, Mercury, Pyrite, Quartz, Silver, Sphalerite",Underground,,,"WORLD MINES REGISTER 1976-77.WORLD MINING, WHAT'S GOING ON IN WORLD MINING, V. 7, NO. 3,MARCH 1971, P. 58.MINING MAGAZINE, MINING ACTIVITY IN THE WESTERN WORLD,V. 140, NO. 1, JANUARY 1979, P. 72.ENGINEERING AND MINING JOURNAL, THIS MONTH IN MINING, V. 180NO. 4, APRIL 1979, P. 172.MINING MAGAZINE, FEBRUARY 1986, PP. 132-133",,Sotiel,B,"Copper, Lead, Sulfur, Zinc",,,,,B,,"Gold, Silver",,,"Difrancesco, Carl A.",,,,,,,
201776,,,,Processing Plant,4690001002,EU,,,https://mrdata.usgs.gov/mrds/show-mrds.php?dep_id=10207054,,POINT (-3.68142 40.4159),,Producer,,,,,,,Hidro Oper,M,"Iron, Manganese",,,,,E,,,,,Unknown,,,,,,,
201908,,,,Surface,4690770002,EU,,,https://mrdata.usgs.gov/mrds/show-mrds.php?dep_id=10207186,,POINT (2.23522 41.48237),,Past Producer,,,,,"DENVER LISTING, APRIL 14, 1975, P. 13.WORLD MINING YEARBOOK, CATALOG, SURVEY AND DIRECTORY NUMBER1979, WORLD WIDE MINING DEVELOPMENTS, V. 32, NO. 8,JULY 25, 1979, P. 221 & 222.1978 ENGINEERING AND MINING JOURNAL INTERNATIONAL DIRECTORYOF MINING AND MINERAL PROCESSING OPERATIONS, MCGRAW-HILL1978, P. 347.1978, WORLD WIDE MINING DEVELOPMENTS, V. 31, NO. 7JUNE 25, 1978, P. 236 & 238.",,Aznacdllar,M,"Copper, Lead, Zinc",,,,,C,,,,,"Ewu, Chiang",,,Barriadas,,,,
201911,,,,Processing Plant,4690451027,EU,,,https://mrdata.usgs.gov/mrds/show-mrds.php?dep_id=10207189,,POINT (-3.63149 38.08257),,Plant,,,,,1987 PAH REPORT,,Linares,M,"Lead, Smelter",,,,,D,,"Silver, Copper",,,"Difrancesco, Carl A.",,,,,,,
201943,,,,Processing Plant,4690418001,EU,,,https://mrdata.usgs.gov/mrds/show-mrds.php?dep_id=10207221,,POINT (-6.93152 37.24935),,Plant,,,,,"* INDUSTRIAL MINERALS. AUG. 1993. NO. 311 P.68. ""TIOXIDECOMMISIONS TIO2 PLANT.""*INDUSTRIAL MINERALS. ""TIOXIDE EXPANDS MATERIALS BUSINESS.""DEC. 1994. NO. 327. P. 11-12.ICI AND TIOXIDE ANNUAL REPORTS.TIOXIDE PRESS RELAESES OF MAY 15, 1991.NOTES FROM A MEETING WITH TIOXIDE STAFF IN LONDON ON MAY 11,1992.NOTES ON OBSERVATION OF PLANT ON JULY 9, 1992.ARTICLES ON POLLUTION CONTROL EXPENDITURES THAT APPEAREDIN: INDUSTRIAL MINERALS, JULY 1990; EUROPEAN CHEMICAL NEWS,MAY 20, 1991; AND EUROPA CHEMIE, APR. 24, 1985 AND APR. 30,1990.",,Huelva Plant  Ti,M,"Titanium, Pigment",,,,,C,,,,,"Kraemer, Sandra R.",,,,,,,
202006,,,,Processing Plant,4690001016,EU,,,https://mrdata.usgs.gov/mrds/show-mrds.php?dep_id=10207290,,POINT (-5.54805 43.32916),,Plant,,,,,"BROOK HUNT & ASSOCIATES LTD., ALUMINIUM SMELTER DATA, 1986,PAGE 205, 1988, PAGE 1.124.U.S. BUREAU OF MINES, BRANCH OF NONFERROUS METALS, ""PRIMARYALUMINUM PLANTS WORLDWIDE"", PART I - DETAIL, PAGE 105,PART II - SUMMARY, PAGE, 11.U.S. BUREAU OF MINES, MINERALS AVAILABILITY PROGRAM,""PRIMARY POST-MILL ALUMINUM SMELTING FACILITIES 1983: A DATABANK"", CONTRACT #J0245003, OCTOBER 1, 1985.MINING JOURNAL, P. 63 (JAN. 22, 1993).",,(Facility) Aviles Smelter,M,"Aluminum, Contained or Metal",,,,,C,,,,,"Buckingham, David A.",,,Aviles,,,,
202031,,,,Surface,4690830001,EU,,,https://mrdata.usgs.gov/mrds/show-mrds.php?dep_id=10207319,,POINT (-1.09812 40.34916),,Producer,,,,,"UN SURVEY OF WORLD IRON ORE RESOURCES 1970, NEW YORK P 284",,Sierra Menera,M,,,,,,D,,,,,"West, B.J.",,"Iron, Silica",,,,,
209784,,,,Underground,4690410010,EU,,,https://mrdata.usgs.gov/mrds/show-mrds.php?dep_id=10215156,,POINT (-7.36491 37.59934),,Plant,"Azurite, Chalcopyrite, Copper, Cuprite, Malachite, Pyrite",Underground,,,"NARBONA, CRISTINA, AND RODRIGUEZ ALCALDE, J.J: ESTUDIO DELA ESSTRUCTURA DEL SEDTOR PIRITA DE LA PROVINCIA DE HUELVAREGIONAL, SERILLE VNIVERSITY, MARCH 1976.STATISTICS BULLETIN, PULISHED BY THE SPANISH NATIONALINSTITUTE OF STATISTICS, MINISTRY OF ECONOMY AND COMMERCE,N0. 437, SEPTEMBER-OCTOBER, 1982.ESTADISTICA MINERA DE ESPANA; PUBLISHED BY THE MINISTRY OFINDUSTRY AND ENERGY FOR THE YEAR, 1981.PROGRAMA NACIONAL DE EXPLOTACION MINERA, PUBLISHED BY THEMINISTRY OF INDUSTRY (DIRECTION GENERAL DE MINAS), 1970.ESTUDIO GEOLOGICO MINERO EN LA HOJA 958, PUEBLA DE GUZMAN,PUBLISHED BY THE INSTITUTO GEOLOGICO Y MINERO DE ESPANA,COPPER FROM SPAIN'S PYRITE BELT; METAL BULLETIN MONTHLY,JUNE, 1982.SPANISH PYRITES-AFUTURE SULFUR SOURCE FOR THE EEC; SULFUR#158, JAN/FEB, 1982.G.K. STRAUSS, J. MADEL AND F. FERNANDEZ ALOSNO; EXPLORATIONPRACTICE FOR STRATE-BOUND VOLCANOGENIC SULFIDE DEPOSITS INTHE SPANISH-PORTUGUESE PYRITE BELT:  GEOLOGY, GEOPHYSICS,AND GEOCHEMISTRY; SPRING ER VERLAG, BERLIN HEIDEKBERG,NEW YORK, 1977.G.K. STRAUSS, K. G. GRAY; THE INTERNATIONAL OUTLOOK FORSPANISH PYRITES; FIFTY IMI CONGRESS MADRID, SPAIN, APRIL,CAMARA OFICIAL MINERA DE HUELVA; PYRITE PRODUCERS YEARLYREPORTS, 1967-1982.BRITISH SULPHUR CORPORATION LTD., WORLD SURVEY OF SULPHURRESOURCES, 1985.",,Herrerias,B,Sulfur,,,,,C,,,,,"Buckingham, David A.",,"Gold, Copper, Zinc, Sulfur-Pyrite, Arsenic, Silver, Lead","Herrerias Mine, Minas De Herrerias, Santa Barbara Copper Mine, Guadiana Mine",,,,
224982,,,,Processing Plant,4690000005,EU,,,https://mrdata.usgs.gov/mrds/show-mrds.php?dep_id=10230781,,POINT (2.98517 39.81581),,Producer,,,,,,,Magnesitas De Rubian,M,Magnesite,,,,,E,,,,,"Wilburn, David R.",,,,,,,
225044,,,,Processing Plant,4690911001,EU,,,https://mrdata.usgs.gov/mrds/show-mrds.php?dep_id=10230843,,POINT (-2.99802 43.34912),,Plant,,,,,,,(Facility) Berango Vizcaya Copper Smelter,M,Copper,,,,,E,,,,,Unknown,,,Berango Vizcaya,,,,
225085,,,,Underground,4690410002,EU,,,https://mrdata.usgs.gov/mrds/show-mrds.php?dep_id=10230888,,POINT (-6.89821 37.69933),,Plant,"Chalcopyrite, Pyrite",Underground,,,"STATISTICS BULLETIN, PUBLISHED BY THE SPANISH NATIONALINSTITUTE OF STATISTICS, MINISTRY OF ECONOMY AND COMMERCE,NO. 437 SEPTEMBER-OCTOBER 1982.ESTADISTICA MINERA DE ESPANA; PUBLISHED BY THE MINISTRYOF INDUSTRY AND ENERGY FOR THE YEAR 1981.PROGRAM NACIONAL DE EXPLOTACION MINERA, PUBLISHED BY THEMINISTRY OF INDUSTRY (DIRECTION GENERAL DE MINAS), 1970.CAMARA OFICIAL MINERA DE HUELVA; PYRITE PRODUCERS YEARLYREPORTS 1967-1982.SEE THE ""R"" REFERENCES.G. K. STRAUSS, J. MADEL AND F. FERNANDEZ ALOSNO; EXPLORATIONPRACTICE FOR STRATE-BOUND VOLCANOGENIC SULPHIDE DEPOSITS INTHE SPANISH-PORTUGUESE PYRITE BELT:  GEOLOGY, GEOPHYSICS,AND GEOCHEMISTRY; SPRING ER VERLAG, BERLIN HEIDELBERG, NEWYORK, 1977.G. K. STRAUSS, K. G. GRAY; THE INTERNATIONAL OUTLOOK FORSPANISH PYRITES; FIFTY IMI CONGRESS MADRID, SPAIN, APRILG. K. STRAUSS, G. ROGER, M. LECOLLE, AND E. LOPERA;GEOCHEMICAL AND GEOLOGICAL STUDY OF THE VOLCANO-SEDIMENTARYSULFIDE OREBODY OF LA ZARZA, HUELVA PROVINCE, SPAIN.""COPPER FROM SPAIN'S PYRITE BELT"", METAL BULLETIN MONTHLY,JUNE 1982.BRITISH SULPHUR CORP. LTD., ""WORLD SURVEY OF SULPHURRESOURCES"", SECOND EDITION, 1974.RESOURCES"", THIRD EDITION, 1985.",,La Zarza-Calanas,B,Sulfur,,,,,C,,Iron,,,"Buckingham, David A.",,"Copper, Lead, Zinc","La Zarza Mine, Silos De Calanas, Huelva",,,,
225128,,,,Surface-Underground,4690410003,EU,,,https://mrdata.usgs.gov/mrds/show-mrds.php?dep_id=10230932,,POINT (-6.65821 37.67933),,Plant,,,,,"MINING MAGAZINE SEPT 1976, TABLE B-1126 MINES ACCOUNTING FORALL OUTPUT OTHER THAN COAL",,Rio Tinto,B,"Copper, Sulfur",,,,,D,,,,,Unknown,,"Lead, Zinc",,,,,
225219,,,,Processing Plant,4690418801,EU,,,https://mrdata.usgs.gov/mrds/show-mrds.php?dep_id=10231044,,POINT (-6.93152 37.24935),,Plant,,,,,"INTERNATINOAL FERTILIZER INDUSTRY ASSOCIATION. PHOSPHORICACID, TRIPLE SUPERPHOSPHATE AND AMMONIUM PHOSPHATE PLANTS1988 SURVEY. AUGUST 1988, 39PP.BRITISH SULPHUR CORPORATION. WORLD FERTILIZER ATLAS, EIGHTHED. APRIL 1987, 121PP.",,Huelva Foret Phos Acid Plant,N,Phosphorus-Phosphates,,,,,D,,,,,"Fantel, Richard J.",,,,,,,
225314,,,,Underground,4690470003,EU,,,https://mrdata.usgs.gov/mrds/show-mrds.php?dep_id=10231129,,POINT (-6.34808 42.32919),,Producer,,,,,"1976 E/MJ INTERNATIONAL DIRECTORY OF MINING, P 285.",,Minero Siderurgica,M,,,,,,D,,,,,"West, B.J.",,Iron,,,,,
225318,,,,Underground,4690910009,EU,,,https://mrdata.usgs.gov/mrds/show-mrds.php?dep_id=10231133,,POINT (-5.83135 43.36586),,Producer,,,,,"STAFF, 1978 ENGINEERING AND MINING JOURNAL INTERNATIONALDIRECTORY OF MINING AND MINERAL PROCESSING OPERATIONS,MCGRAW-HILL 1978, P. 348.",,Villabona-Asturias,B,"Barium-Barite, Fluorine-Fluorite, Lead, Zinc",,,,,D,,,,,"Ewu, Chiang",,,,,,,
