,county,arock_unit,structure,oper_type,mas_id,region,conc_proc,ore_ctrl,url,model,geometry,discr,dev_stat,other_matl,work_type,mrds_id,dep_type,ref,ylp_ba,site_name,com_type,commod1,prod_size,hrock_unit,arock_type,alteration,score,hrock_type,commod2,yfp_ba,prod_yrs,reporter,orebody_fm,commod3,names,ore,tectonic,gangue,dy_ba
22103,,,,Unknown,,EU,,,https://mrdata.usgs.gov/mrds/show-mrds.php?dep_id=10022511,,POINT (-8.14823 53.17549),,Past Producer,,,DE03096,,"PATTERSON, S.H., 1967, BAUXITE RESERVES AND POTENTIAL ALUMINUM RESOURCES OF THE WORLD: USGS BULL. 1228, 176 PPATTERSON 1967.",,Northern Ireland,M,Aluminum,Y,,,,C,Basalt,,,,"Mosier, Dan",,,"Hill, Ballynabanist Mines, Skerry, Lyles","Anatase, Boehmite, Brookite, Corundum, Gibbsite, Goethite, Halloysite, Hematite, Ilmenite, Kaolin, Magnetite, Rutile, Siderite",,,
71146,,,In Hanging Wall Of Major Ene Trending Normal Fault,Unknown,,EU,,Fault Control,https://mrdata.usgs.gov/mrds/show-mrds.php?dep_id=10073081,208: Sedimentary exhalative Zn-Pb,POINT (-8.231 52.78245),,Producer,,,W018892,,"MORRISSEY, C. J., DAVIS, G. R., STEED G. M., 1971, MINERALIZATION IN THE LOWER CARBONIFEROUS IN CENTRAL IRELAND; TRANS. INST. MIN. METALL. V 80 P. B 174 - 185LAWLOR, J. F., 1970, GENESIS OF MASSIVE SULFIDE DEPOSITS IN CARBONATE SEDIMENTS AT SILVERMINES, IRELAND; DISS. ABSTR. INTL. V 31 NO. 5 P. 2766 BCOOMER, P. G., ROBINSON, B. W., 1976, SULPHUR AND SULPHATE - OXYGEN ISOTOPES AND THE ORIGIN OF THE SILVERMINES DEPOSITS, IRELAND;  MINERAL. DEPOSITA V. 11, NO. 2, P. 155 - 169MENZIE AND MOSIER, 1985:  U.S. GEOLOGICAL SURVEY OPEN-FILE REPORT 85-206.MINING ANNUAL REVIEW, 1976, P. 516TOTAL DEPOSIT SIZE FROM MENZIE AND MOSIER, 1985.",,Silvermines,M,"Zinc, Lead",L,Dolomite Breccia;Muddy Limestones;Dolomite,,"Dolomitization & Formation Of Pyrite, Arsenopyrite",B,"Limestone,Dolomite",Silver,,,"Schruben, Paul G., Orris, Greta J.",BEDDED AND VEINS,,Mogul,"Galena, Sphalerite",,"Barite, Boulangerite, Bournonite, Calcite, Dolomite, Pyrrhotite, Quartz",
71147,,,"Caledonian Fold Belt, North Tynagh Fault Forms - The Orebody'S Southern Boundary",Unknown,,EU,Solution And Retransport Has Enriched Upper Orebody Sulphides And Oxides,Fault Control,https://mrdata.usgs.gov/mrds/show-mrds.php?dep_id=10073082,208: Sedimentary exhalative Zn-Pb,POINT (-8.38098 53.14912),Irish Base Metals Ltd,Past Producer,,,W018895,,"DOWN, R. F., TURNER, JAMES, 1970, CONCENTRATION OF OXIDE ORES AT TYNAGH; IN RAUSCH D. O., MARIACHER, B. C., AIME. SYMP. PB - ZN, V 1 P 710 - 31, 950 - 1DERRY, D. R., CLARK, G. R., GILLATT, N., 1965, THE NORTHGATE BASE - METAL DEPOSIT AT TYNAGH, COUNTY GALWAY, IRELAND; ECON. GEOL. V 60 P. 1218 - 1237MORRISSEY, C. J., DAVIS, G. R., STEED, G. M., 1971, MINERALIZATION IN THE LOWER CARBONIFEROUS OF CENTRAL IRELAND; TRANS. INST. MIN. METALL. V 80 P. B 174 - 185MENZIE AND MOSIER, 1985:  U.S. GEOLOGICAL SURVEY OPEN-FILE REPORT 85-206.NORTHERN MINER, 4-14-77, P. 26.1961 GEOCHEM IRISH BASE METALS - ANOMALY FOUNNORTHERN MINER 4-14-77, P. 261976 ESTIMATE FROM NORTHERN MINER, 1977.  DEPOSIT SIZE ESTIMATE FROM MENZIE AND MOSIER, 1985.",,"Tynagh Pb, Zn, Cu, Ag Mine",M,"Lead, Zinc, Silver",L,Waulsortian Reef Limestone,,Dolomitization Of Wallrock,B,Limestone,Copper,,,"Schruben, Paul G., Orris, Greta J.",BOAT SHAPED (SECONDARY ORE) IRREGULAR (PRIMARY ORE),"Cadmium, Peat",,"Chalcopyrite, Galena, Mimetite, Sphalerite",,"Albite, Barite, Bournonite, Calcite, Chlorite, Geocronite, Marcasite, Millerite, Pyrite, Quartz, Siegenite",
77553,,,"Gently Sw-Plunging Anticline With Core Of Devonian Red Beds., Faults. Fault Ene-Strike Dip S. Southern Flank Downthrown",Unknown,,EU,,"Dolomitic Limestones, Faults (A & B)",https://mrdata.usgs.gov/mrds/show-mrds.php?dep_id=10079609,,POINT (-8.14823 53.17549),,Occurrence,,,W029648,Stratabound,"SRC.REF: CONF. REPORT BURTONDOWNES, K. 1977 (CONFID. REPORT) MAJOR BASE METAL DEPOSITS OF IRELAND.- INSTITUTE FOR INDUSTRIAL RESEARCH & STANDAR    DS.BURTON, C. 1977 (CONFID. REPORT) TECHNOLOGY OF MINING, CONCENTRATE PRODUCTION AND METALLURGY IN IRELAND. (JRS. SEPT.1977)",,"Bula, Navan, Ireland",M,"Lead, Zinc",N,Conglomerate Group & Visean Upper Dark Limestone;Palebeds Containing Orebodies;Muddy Limestone;Redbeds (Sandstones),,,D,Limestone,,,,"Krauss, Ulrich H.",,Silver,Nevinstown,"Galena, Sphalerite",,,
77564,,,"Gently Sw-Plunging Anticline With A Core Of Devonian Red Beds, Fault Striking Ene, Dipping South",Unknown,,EU,,Pale Beds (Dolomitic Limestones),https://mrdata.usgs.gov/mrds/show-mrds.php?dep_id=10079610,208: Sedimentary exhalative Zn-Pb,POINT (-6.68094 53.64909),,Producer,,Underground,W029649,,"DOWNES, K. 1977 (CONFID.REPORT) MAJOR BASE METAL DEPOSITS OF IRELAND.- INSTITUTE FOR INDUSTRIAL RESEARCH & STANDARS.WORLD MINING AUGUST 1977 PP 42-44MINING MAGAZINE, OCTOBER 1977 PP.300-318BURTON, C. 1977 (CONFID. REPORT) JJRS.O'BRIEN, M.V., AND ROMER, D.M., 1971, TARA'S ZINC-LAD DISCOVERY AT NAVAN, REPUBLIC OF IRELAND:  CANADIAN MINING JOURNAL, APRIL, 1971, P. 81-82.MENZIE AND MOSIER, 1985:  U.S. GEOLOGICAL SURVEY OPEN-FILE REPORT 85-206.ENGINEERING AND MINING JOURNAL, AUGUST, 1976, P. 135.KENNEDY, ALAN, 1989, TARA MINE RE-EQUIPS FOR RAISED PRODUCTIVITY:  MINING MAGAZINE, APRIL, 1989, P. 262-268.KENNEDY, 1989, P. 262.",,Navan,B,"Zinc, Lead",Y,Conglomerate Group & Visean Upper Dark Limestone;Pale Beds (Contain Orebodies);Muddy Limestone;Red Beds,,,B,Limestone,Silver,,,"Krauss, Ulrich H., Bolm, Karen S.",TABULAR LENSES (STACKED LENSES),Barium-Barite,"Tara, An Uaimh","Barite, Fluorite, Galena, Sphalerite",,"Calcite, Dolomite, Quartz",
94960,,,,Unknown,,EU,,,https://mrdata.usgs.gov/mrds/show-mrds.php?dep_id=10097435,,POINT (-6.68094 53.64909),,Prospect,,,W018893,,"STAFF, 1976, MINING JOURNAL 10-29-76 P. 342MINING MAGAZINE 2 - 77 P. 125",,Rennicks and Bennett Pb - Zn Prospect,M,"Zinc, Lead",N,Dolomitic Sandy Limestone,,,C,Limestone,,,,"Schruben, Paul G.",,,,"Galena, Sphalerite",,,
130270,,,,Underground,4190430001,EU,,,https://mrdata.usgs.gov/mrds/show-mrds.php?dep_id=10133767,,POINT (-8.25767 52.79912),,Producer,"Calcite, Dolomite, Galena, Pyrite, Sphalerite",Underground,,,"ATKINSON, PAUL H., MOGUL OF IRELAND, LTD., FACTSHEET FROMDENVER EQUIPMENT COMPANY, 8PP, UNDATEDCANADIAN MINES HANDBOOK, 1975-76, NORTHERN MINER PRESS LTD.,TORONTO, P.144.FILION, M., 1975, SPATIAL DISTRIBUTION OF SULFIDE ORES ATTHE MOGUL MINE, SILVERMINES, IRELAND. PART I: A NEWCONCEPTUAL APPROACH, TRANSACTIONS, CANADIAN INST. ON MIN.AND METALL., VOL. LXXVIII, P. 98-107.HOPPE, RICHARD, 1978, MOGUL USES VARIETY OF STOPING SYSTEMSAS ORE DIP VARIES: PART OF, THE EMERGENCE OF MODERNIRISH METAL MINES: IN E/MJ OPERATING HANDBOOK OF MINERALUNDERGROUND MINING VOL. 3, SISSELMAN, ROBERT, ED.,P. 304-313.KERR ADDISON MINES LTD., ANNUAL REPORTS, 1975-1980.MINING MAGAZINE, TRACKLESS MINING AT MOGUL, JAN. 1982,P. 21-23.MINING MAGAZINE, IRELAND, AUG. 1972, P.163-167.NIGHTINGALE, U.G., ED., FINANCIAL TIMES MINING INTERNATIONALYEARBOOK, 1980, LONGMAN, LONDON, P. 382, 499-500.NORANDA MINES LTD.,ANNUAL REPORT, 1980.SIEGAL, HAROLD O., 1965, THREE RECENT IRISH DISCOVERY CASEHISTORIES USING PULSE-TYPE INDICED POLARIZATION, TRANS.,CAN. INST. MIN., VIL. LXVIII, P.343-348.TINSLEY, C. RICHARD, SILVERMINES-EUROPE'S LARGEST UNDER-GROUND ZINC-LEAD PRODUCER, E/MJ, NOV.1973, P.150-152.WILLIAMS, C.E., AND MCARDLE, P., IRELAND-SILVERMINES: INMINERAL DEPOSITS OF EUROPE, VOL. I: BOWIE, S.H.U.,KVALHEIM, A., AND HASLUM, H.W., EDS., INST. OF MIN. ANDMETALL., LONDON, 1978, P. 333-336.",,Mogul,M,"Zinc, Lead",,,,,C,,Silver,,,Eastern Field Operations Center (EFOC),,,,,,,
130467,,,,Surface-Underground,4190310001,EU,,,https://mrdata.usgs.gov/mrds/show-mrds.php?dep_id=10133979,,POINT (-9.53093 53.79914),,Prospect,,,,,"QUARTERLY MINE ANALYSIS, P. 31 (JUNE 1993).",,Lecanvey,M,Gold,,,,,D,,,,,Unknown,,,,,,,
177643,,,,Surface,4190430003.0,EU,,,https://mrdata.usgs.gov/mrds/show-mrds.php?dep_id=10182288,,POINT (-8.29268 52.60102),,Producer,Barite,Surface,,,"GRENNAN, E.  BALLYNOE BARITE DEPOSIT, IRELAND 1979.EXCURSION HANDBOOK, 1979.ENGINEERING AND MINING J.  IRELAND'S NEW MINES CONTINUEGOING ON STREAM, AUG. 1968, P. 72.MINING MAGAZINE.  OPEN PIT BARITE MINING AT BALLYNOE,IRELAND, MARCH 1983, PP. 196-200.",,Ballynoe,N,Barium-Barite,,,,,B,,,,,"Hite, Alan G.",,,"Silvermines, Ballynoe Barite",,,,
177706,,,,Underground,4190510001.0,EU,,,https://mrdata.usgs.gov/mrds/show-mrds.php?dep_id=10182352,,POINT (-6.23095 52.86578),,Past Producer,,Underground,,,"CANADIAN MINES HANDBOOK, 1972-1973, NORTHERN MINER PRESSLTD. TORONTO, CANADA. 1972, P. 39.CANADIAN MINES HANDBOOK, 1975-1976, NORTHERN MINER PRESSLTD. TORONTO, CANADA. 1975, PP. 34-35.WYLLIE,R.J.M. ""AVOCA IS IRELAND'S NEWEST COPPER PRODUCER INA HISTORIC CENTER"". WORLD MINING, NOV. 1971, PP. 341-347.E/MJ NOV. 1973, MINING IN IRELAND, PP.154-157.WORLD MINING, DEC. 1973. WHAT'S HAPPENING IN WORLD MINING,EUROPE, IRELAND.1978 E/MJ INTERNATIONAL DIRECTORY OF MINING, P. 282.PERSONAL CORRESPONDENCE, FEB. 1978, AVOCA MINES LIMITED,",,Avoca,B,Copper,,,,,C,,,,,"Boyle, Ed",,"Zinc, Silver, Lead, Sulfur",,,,,
201422,,,,Underground,4190190001,EU,,,https://mrdata.usgs.gov/mrds/show-mrds.php?dep_id=10206684,,POINT (-7.49767 52.7491),,Plant,"Galena, Sphalerite",Underground,,,"PEFR BY C.M. PALENCIAENGINEERING & MINING JOURNAL, JULY 1990MINING MAGAZINE, APRIL 1989, PP.23-24MINING MAGAZINE, DECEMBER 1989MINING JOURNAL, NOVEMBER 21, 1986MINING ANNUAL REVIEW, 1988INTERNATIONAL MINING, SEPTEMBER 1988ENGINEERING & MINING JOURNAL, MAY 1990MINING MAGAZINE, JANUARY, 1994, P. 8.",,Galmoy,M,"Lead, Zinc",,,,,B,,,,,"Difrancesco, Carl A.",,,,,,,
201463,,,,Underground,4190130001,EU,,,https://mrdata.usgs.gov/mrds/show-mrds.php?dep_id=10206725,,POINT (-9.04765 53.26583),,Producer,,,,,"STAFF, 1978 ENGINEERING AND MINING JOURNAL INTERNATIONALDIRECTORY OF MINING AND MINERAL PROCESSING OPERATIONS,MCGRAW-HILL, 1978, P. 282.WORLD MINING CATALOG, SURVEY & DIRECTORY NUMBER, 1966.WORLD WIDE MINING ACTIVITIES, V. 19, NO. 7, JUNE 25, 1966,P. 77.SCHULTZ, RICHARD W., LOWER CARBONIFEROUS CHERTY IRONSTONESAT TYNAGH, IRELAND. P. 312.ENGINEERING AND MINING JOURNAL, MINING IN NORTHWESTEUROPE, TYNAGH-FLEXIBILITY IS THE KEY TO SUCCESSFUL OPER-ATIONS. V. 174, NO. 11, NOV. 1973, P. 148, 149.MINING MAGAZINE, MAJOR NEW DEVELOPMENTS UNDERWAY ATIRELAND'S BASE METAL MINES, JANUARY 1972, P. 12, 13.MINING MAGAZINE, UNDERGROUND DEVELOPMENT AT THE TYNAGH MINE,VOL. 121, NO. 3, SEPTEMBER 1969, P. 211, 213.NIGHTINGALE, WM. G., MINING INTERNATIONAL YEARBOOK, 1978,THE FINANCIAL TIMES LIMITED, 1978, P. 426, 427.WORLD MINING CATALOG, SURVEY & DIRECTORY NUMBER 1978, V. 31,NO. 7, JUNE 25, 1978, P. 299.",,Tynagh,N,,,,,,C,,,,,"Ewu, Chiang",,Barium-Barite,,,,,
201502,,,,Surface,4190451061,EU,,,https://mrdata.usgs.gov/mrds/show-mrds.php?dep_id=10206766,,POINT (-7.63098 52.5991),,Producer,,,,,,,Quigley Magnesite Company,M,Magnesite,,,,,E,,,,,"Wilburn, David R.",,,Quigley Magnesite Comp,,,,
201616,,,,Underground,4190330001,EU,,,https://mrdata.usgs.gov/mrds/show-mrds.php?dep_id=10206886,,POINT (-6.73091 53.65739),,Producer,"Barite, Calcite, Fluorite, Galena, Sphalerite",Underground,,,"CANADIAN MINES HANDBOOK, NORTERN MINER PRESS, TORONTO, CAN.JULY 1973, PP 316-317CANADIAN MINES HANDBOOK, NORTHERN MINER PRESS, TORONTO, CANJULY 1976, P.282.BYRNE, B-, DOWLING, D. AND ROMER D. OF TARA EXPLORATION CO.PAPER PRESENTED AT SYMPOSIUM ENTITLED ""THE GENESIS OFBASE METAL DEPOSITS IN IRELAND, NOV 1971 GALWAY MEETINGOF THE IRISH GEOLOGICAL ASSOCIATIONMINING MAGAZINE, JAN 1972, TARA'S NAVAN DEPOSIT, P 25.WORLD MINING, JULY 1972, WHAT'S GOING ON IN WORLD MINING,IRELAND. TARA HAS 51,945,000 TONS OF GOOD GRADE ZN-PR OREIN SIGHT AT NAVAN FOR 20 YEARS  OF MININGE/MJ NOV 1973, TARA HUGE ZN-PB RESERVES TARGETED FOR MININGIN 1975 PP. 152-154WORLD MINING, MARCH 1974, WHAT'S HAPPENING IN WORLD MINING,EUROPE, IRELANDMETALS SOURCEBOOK, AUG 12, 1974, ITEM B3831.MINING MAGAZINE, MARCH 1975, MINING LEASE AGREED FOR TARA'SNAVAN PB-ZN DEPOSIT IN IRELANDE/MJ, APRIL 1975, IRELAND AND TARA EXPLORATION AGREE ONMINING MAGAZINE, JULY 1975, TARA-IRELAND'S MAJOR PB/ZNPROSPECT STILL INVOLVED IN LEASE TALKS PP 14-19.1976 E/MJ INT.DIR. OF MINING AND MINERAL PROCESSING UNITS,1976 MCGRAW HILL, N.Y., P 278.SKINNER, WALTER R., MINING INTERNATIONAL YEARBOOK,'76 P 520E/MJ MAY 1976, THIS MONTH IN MININGE/MJ, APRIL 1976, THIS MONTH IN MINGWORLD MINING, APRIL 1976 HIGHLIGHTS.THE FINANCIAL POST SURVEY OF MINES 1976, TORONTO CANADA,1975, MACLEAN-HUNTER LTD, P 147THE FINANCIAL POST SURVEY OF MINES, 1977, TORONTO, CANADA,1976 MACLEAN-HUNTER LTD P 220.DALLAS, W.G., 1977, ENVIRONMENTAL HARMONY- AN OBJECTIVE INMINE PLANNING AND DEVELOPMENT: CAN. INST. MIN.,BULLETIN, OCT. 1977, P. 81-88.E/MJ, SEPT. 1977, P. 83-98.MINING MAGAZINE, AUG. 1972, P. 163-168.MINING MAGAZINE, MAY 1977, P. 333.MINING MAGAZINE, NOV. 1979, P. 413-414.METALS WEEK, JAN. 5, 1981, P. 2.NORANDA EXPLORATION LTD ANNUAL REPORTS 1979, 1980.NORTHGATE ANNUAL REPORTS 1979, 1980.TARA EXPLORATION AND DEVELOPMENT ANNUAL REPORTS 1972-1980.WILLIAMS, C.E., AND MCARDLE, P., 1978, IRELAND-NAVAN INMINERAL DEPOSITS OF EUROPE, VOL. I, BOWIE, S., ET AL,EDS., INST. MIN., METALL., LONDON, P. 329-331.WORLD MINING, JUNE 1971, P. 35-38.WORLD MINING, AUG. 1977, P. 42-44.MINING MAGAZINE, JULY 1977, P. 6-7.AME MINERAL ECONOMICS QUARTERLY MINE ANALYSIS, JUNE, 1993,P. 38, 48.",,Tara-Navan,M,"Lead, Zinc",,,,,B,,,,,"Difrancesco, Carl A.",,,,,,,
201698,,,,Surface-Underground,4190510002,EU,,,https://mrdata.usgs.gov/mrds/show-mrds.php?dep_id=10206967,,POINT (-6.23095 52.86578),,Prospect,,,,,,,East Avoca,M,Copper,,,,,E,,,,,Unknown,,,,,,,
201807,,,,Underground,4190470001,EU,,,https://mrdata.usgs.gov/mrds/show-mrds.php?dep_id=10207085,,POINT (-7.49763 53.4991),,Prospect,"Galena, Sphalerite",Underground,,,"RIO TINTO ZINC MINING COST ANALYSIS SYSTEM.  PERFORMANCEANALYSIS.  APRIL 14, 1975, P. 14.MINING JOURNAL.  BALLINALACK ASSAY.  JUNE 3, 1977, P. 435.WORLD MINING CATALOG, SURVEY AND DIRECTORY NUMBER.  IRELAND.JUNE 1971, P. 139.MINING MAGAZINE, NOV. 1979, UPDATE ON IRISH MINING ANDEXPLORATION, PP. 413-414.WILLIAMS, C.E., AND MCARDEL, P. 1978, IRELAND-BALLINALACK:IN MINERAL DEPOSITS OF EUROPE, VOL. I; BOWIE, S.H.V.,KVALHEIM A., AND HASLUM, H.W. EDS., INSTITUTION OF MIN.,METALL, LONDON, PP. 338-339.",,Ballinalack Project,M,"Lead, Zinc",,,,,B,,,,,Gazdik,,,,,,,
201931,,,,Surface,4190270001,EU,,,https://mrdata.usgs.gov/mrds/show-mrds.php?dep_id=10207209,,POINT (-10.08092 53.96586),,Prospect,,,,,"MINIMG JOURNAL, 03/10/95, ""OVOCA'S IRISH DRILLING"".",,Keel,M,"Lead, Zinc",,,,,D,,,,,"Buckingham, David A.",,,,,,,
225364,,,,Surface,4190291061,EU,,,https://mrdata.usgs.gov/mrds/show-mrds.php?dep_id=10231178,,POINT (-6.3309 53.71578),,Producer,,,,,,,Drogheda,M,Magnesite,,,,,E,,,,,"Wilburn, David R.",,,,,,,
233618,,,,Processing Plant,4190131171,EU,,,https://mrdata.usgs.gov/mrds/show-mrds.php?dep_id=10239551,,POINT (-8.36435 53.14912),,Producer,,,,,,,Tynagh Operations,N,Barium-Barite,,,,,E,,,,,Hunter,,,,,,,
249074,,,,Surface,4190430002,EU,,,https://mrdata.usgs.gov/mrds/show-mrds.php?dep_id=10255471,,POINT (-8.28099 52.48242),,Past Producer,,,,,"WORLD MINING.  EUROPE.  IRELAND...GORTDRUM'S 1969 RESULTSAND PROJECTIONS FOR THE 1970'S.  AUGUST 1970, P. 49.WORLD MINING.  IRELAND...GORTDRUM MINES HITS ZINC-LEAD INFIRST MOATE DRILL HOLE.  MAY 1968, P. 47.ENGINEERING AND MINING JOURNAL.  GORTDRUM--PRODUCER OF COP-PER AND BYPRODUCT MERCURY.  NOVEMBER 1973, P. 160.MINING MAGAZINE.  GORTDRUM COPPER AND MERCURY.  MONTH, YEAR,PAGE AREN'T KNOWN.MINING MAGAZINE.  GORTDRUM MERCURY PLANT.  FEBRUARY 1970,P. 131.MINING MAGAZINE.  THE DISCOVERY AND OPENING OF GORTDRUM.JUNE 1968, PP. 372-379.MINING JOURNAL.  NORTHGATE EXPLORATION.  OUT OF THE RED.MAY 27, 1977, P. 422.WORLD MINING.  ANOTHER BIG MINE FOR IRELAND:  GORTDRUM COP-PER PIT AND MILL.  YEAR, MONTH, PAGE AREN'T KNOWN.",,Gortdrum,M,Copper,,,,,D,,Mercury,,,Minerals Availability Field Office (Mafo),,Silver,,,,,
249116,,,,Underground,4190330002,EU,,,https://mrdata.usgs.gov/mrds/show-mrds.php?dep_id=10255511,,POINT (-6.68091 53.64909),,Prospect,"Galena, Sphalerite",Underground,,,"THE POSSIBILITY OF JOINT PRODUCTION BY IRELAND'S BULA MINESAND TARA MINES, ENGINEERING AND MINING JOURNAL, APRIL1977, P. 9.BULA SLATED TO PRODUCE AT 1000000 TONS IN MID-1978, WORLDMINING DECEMBER 1976, P. 64.NAVAN ZINC: DIVERSIONARY TACTICS?, MINING JOURNAL JANUARY19, 1979, P. 39.STAFF, ENGINEERING AND MINING JOURNAL, JANUARY 1979, P. 99.STAFF, ENGINEERING AND MINING JOURNAL, JANUARY 1978, P. 72.NJZ STUDIES IRISH ZINC SMELTER, MINING JOURNAL, APRIL 1,1977, P. 242.TINSLEY, C. R., IRELAND: ON THE WAY TO BECOMING TOP PRODUCEROF BASE METALS IN NORTHWEST EUROPE, ENGINEERING ANDMINING JOURNAL, NOVEMBER 1973, P. 144-147.STAFF, IRELAND, WORLD MINING CATALOGUE SURVEY DIRECTORYNUMBER, JUNE 1976, P. 65.CUNNINGHAM, M. A., EIRE, MINING ANNUAL REVIEW 1976, LONDONMINING JOURNAL, 1977, P. 509-510.BULA DEVELOPMENT NEXT YEAR?, MINING JOURNAL, DEC. 29, 1978,P. 507.SKINNER,W., MINING INTERNATIONAL YEARBOOK, P. 154.STAFF, MINING MAGAZINE, JAN. 1979, P. 71.STAFF, 1978 ENGINEERING AND MINING JOURNAL INTERNATIONALDIRECTORY OF MINING AND MINERAL PROCESSING OPERATIONS,MCGRAW-HILL, NEW YORK, 1978, P. 282.ENGINEERING AND MINING JOURNAL, FEB. 1977, P.14., APR. 1977,P. 150.CUNNINGHAM, M.A. 1978, EIRE, MINING JOURNAL, PP. 509-511ENG. MIN. JOURNAL, 1977, IRELAND, ENG./MIN. JOURNAL, APR.,MINING JOURNAL, 1979, NAVAN ZINC: DIVERSIONARY TACTICS?,JAN. 1979, P. 29.MINING JOURNAL NOV. 1979, BULA SUBMITS COUNTY MEATH PLAN,P. 461.MINING JOURNAL, MAY 22, 1981, BULA APPLICATION REJECTED,P. 393.MINING MAGAZINE, AUG. 1972, NAVAN LEAD-ZINC, PP. 167-168.MINING MAGAZINE, MAY 1977, IRISH ZINC SMELTER PLANS ANNOUNC-ED, P. 33.MINING MAGAZINE, NOV. 1979, UPDATE ON IRISH MINING ANDEXPLORATION, PP. 413-414.WILLIAMS, C.E., AND MCARDLE, P. 1978, IRELAND-NAVAN: INMINERAL DEPOSITS OF EUROPE, VOL. 1, BOWIE, W.H.U.,KVALHEIM, A., AND HASLUM, H.W., EDS., INSTITUTION OF MIN.,METALL., LONDON, PP. 329-331.WORLD MINING, NOV. 1975. BULA ZINC-LEAD ARE RESERVES OVER20, 000 TONS P. 39.WORLD MINING, JULY 1980, IRELAND, P. 103.",,Bula-Navan,M,"Lead, Zinc",,,,,B,,Silver,,,Gazdik,,,,,,,
296413,,,,Underground,4190330003.0,EU,,,https://mrdata.usgs.gov/mrds/show-mrds.php?dep_id=10303964,,POINT (-6.73931 53.68909),,Prospect,"Galena, Sphalerite",Underground,,,"NIGHTINGALE, W.G., (ED.), 1979, FINANCIAL TIMES MININGINTERNATIONAL YEAR BOOK 1980: LONGMAN, LONDON, 701P.ENGINEERING/MINING JOURNAL, 1980, INTERNATIONAL DIRECTORY OFMINING.WORLD MINES REGISTER 1979-80, P.82 AND 172.ENGINEERING/MINING JOURNAL, OCTOBER 1978, P.290.",,Sabina-Tatestown,M,"Zinc, Lead",,,,,C,,,,,Rfb,,,,,,,
296547,,,,Processing Plant,4190251171.0,EU,,,https://mrdata.usgs.gov/mrds/show-mrds.php?dep_id=10304100,,POINT (-9.09769 52.61583),,Producer,,,,,,,Foynes Grinding Plant,N,Barium-Barite,,,,,E,,,,,Hunter,,,,,,,
296653,,,,Processing Plant,4190252001.0,EU,,,https://mrdata.usgs.gov/mrds/show-mrds.php?dep_id=10304207,,POINT (-8.1144 52.28241),,Plant,,,,,"ALUMINUM PRODUCTION COST SURVEY, 1980-1985 BROOK HUNT ANDASSOCIATES LTD. PG.308 (RECORDS 1,6)ALUMINUM PRODUCTION COST SURVEY, 1988 BROOK HUNT AND ASSOC-IATES LTD. PG.2.37 (RECORDS 4-5,7)",,Aughinish,M,Aluminum,,,,,C,,,,,"Wilburn, David R.",,,,,,,
8303,,,,Unknown,,EU,,,https://mrdata.usgs.gov/mrds/show-mrds.php?dep_id=10008192,,POINT (-2.28153 37.49927),,Occurrence,,,D000166,,"MARIN, D. A., 1942-SEE USGS BULL. 1316",,Oria Area,M,"Lead, Molybdenum, Vanadium",N,,,,D,,,,,"Fischer, Richard P.",,,,,,,
8304,,,,Unknown,,EU,,,https://mrdata.usgs.gov/mrds/show-mrds.php?dep_id=10008193,,POINT (-3.58154 37.16597),,Occurrence,,,D000167,,"MORENO MARTIN, F., 1932-SEE USGS BULL. 1316",,Granada Area,M,"Lead, Zinc, Vanadium",N,,,,D,,,,,"Fischer, Richard P.",,,,,,,
22965,,,,Unknown,,EU,,,https://mrdata.usgs.gov/mrds/show-mrds.php?dep_id=10023451,,POINT (-7.99806 42.99922),,Occurrence,,,I000422,,"AGARD, J., AND EMBERGER, A., 1989, INTRODUCTION TO SOUTHWEST EUROPE, IN DUNNING, F.W., GARRARD, P., HASLAM, H.W., AND IXER, R.A., EDS., MINERAL DEPOSITS OF EUROPE, VOLUME 4/5:  SOUTHWEST AND EASTERN EUROPE, WITH ICELAND:  LONDON, THE INSTITUTION OF MINING AND METALLURGY AND THE MINERALOGICAL SOCIETY, P. 1-36AGARD AND EMBERGER, 1989.",,Galicia,N,Kaolin,U,,,,D,Granite,,,,"Orris, Greta J.",,,,Kaolin,,,
22966,,,"Navarra Basin, Syncline",Unknown,,EU,,,https://mrdata.usgs.gov/mrds/show-mrds.php?dep_id=10023452,,POINT (-1.71472 42.73244),,Past Producer,,,I000423,,"AGARD, J., AND EMBERGER, A., 1989, INTRODUCTION TO SOUTHWEST EUROPE, IN DUNNING, F.W., GARRARD, P., HASLAM, H.W., AND IXER, R.A., EDS., MINERAL DEPOSITS OF EUROPE, VOLUME 4/5:  SOUTHWEST AND EASTERN EUROPE, WITH ICELAND:  LONDON, THE INSTITUTION OF MINING AND METALLURGY AND THE MINERALOGICAL SOCIETY, P. 1-36.VAZQUEZ, GUZMAN, F., 1989, SPAIN, IN DUNNING, F.W., GARRARD, P., HASLAM, H.W., AND IXER, R.A., EDS., MINERAL DEPOSITS OF EUROPE, VOLUME 4/5:  SOUTHWEST AND EASTERN EUROPE, WITH ICELAND:  LONDON, THE INSTITUTION OF MINING AND METALLURGY AND THE MINERALOGICAL SOCIETY, P. 105-196.VAZQUEZ GUZMAN, 1989.FIGURE 2 - AGARD AND EMBERGER, 1989; FIGURES 2 AND 3 - VAZQUEZ GUZMAN, 1989.",,Perdon,N,Potassium,Y,,,,B,Evaporite,,,,"Orris, Greta J.",,"Gypsum-Anhydrite, Halite",,Carnallite,,"Anhydrite, Halite",
22969,,,Keuper Salt Dome,Unknown,,EU,,,https://mrdata.usgs.gov/mrds/show-mrds.php?dep_id=10023455,,POINT (-1.0315 38.39922),,Past Producer,,,I000438,,"VAZQUEZ, GUZMAN, F., 1989, SPAIN, IN DUNNING, F.W., GARRARD, P., HASLAM, H.W., AND IXER, R.A., EDS., MINERAL DEPOSITS OF EUROPE, VOLUME 4/5:  SOUTHWEST AND EASTERN EUROPE, WITH ICELAND:  LONDON, THE INSTITUTION OF MINING AND METALLURGY AND THE MINERALOGICAL SOCIETY, P. 105-196VAZQUEZ GUZMAN, 1989.",,Pinoso,N,Halite,Y,,,,C,Evaporite,,,,"Orris, Greta J.",,Gypsum-Anhydrite,,Halite,,Gypsum,
22970,,,,Unknown,,EU,,,https://mrdata.usgs.gov/mrds/show-mrds.php?dep_id=10023456,,POINT (-3.28141 42.01582),,Producer,,,I000439,,"VAZQUEZ, GUZMAN, F., 1989, SPAIN, IN DUNNING, F.W., GARRARD, P., HASLAM, H.W., AND IXER, R.A., EDS., MINERAL DEPOSITS OF EUROPE, VOLUME 4/5:  SOUTHWEST AND EASTERN EUROPE, WITH ICELAND:  LONDON, THE INSTITUTION OF MINING AND METALLURGY AND THE MINERALOGICAL SOCIETY, P. 105-196VAZQUEZ GUZMAN, 1989.",,Valderrodero,M,Magnesite,Y,,,,C,Carbonate,,,,"Orris, Greta J.",,,Magna Group,Magnesite,,"Chlorite, Dolomite, Quartz, Talc",
22971,,,Folding.,Unknown,,EU,,,https://mrdata.usgs.gov/mrds/show-mrds.php?dep_id=10023457,,POINT (1.83526 41.91574),,Producer,,,I000440,,"VAZQUEZ, GUZMAN, F., 1989, SPAIN, IN DUNNING, F.W., GARRARD, P., HASLAM, H.W., AND IXER, R.A., EDS., MINERAL DEPOSITS OF EUROPE, VOLUME 4/5:  SOUTHWEST AND EASTERN EUROPE, WITH ICELAND:  LONDON, THE INSTITUTION OF MINING AND METALLURGY AND THE MINERALOGICAL SOCIETY, P. 105-196VAZQUEZ GUZMAN, 1989.",,Balsareny - Sallet Mines,N,Potassium,Y,,,,C,Evaporite,,,,"Orris, Greta J.",,Halite,,"Carnallite, Sylvanite",,Halite,
22972,,,,Unknown,,EU,,,https://mrdata.usgs.gov/mrds/show-mrds.php?dep_id=10023458,,POINT (-4.01481 39.86589),,Producer,,,I000441,,"VAZQUEZ, GUZMAN, F., 1989, SPAIN, IN DUNNING, F.W., GARRARD, P., HASLAM, H.W., AND IXER, R.A., EDS., MINERAL DEPOSITS OF EUROPE, VOLUME 4/5:  SOUTHWEST AND EASTERN EUROPE, WITH ICELAND:  LONDON, THE INSTITUTION OF MINING AND METALLURGY AND THE MINERALOGICAL SOCIETY, P. 105-196VAZQUEZ GUZMAN, 1989.",,El Castellar Mine,B,Sodium,Y,,,,C,"Clay, Mud,Evaporite",,,,"Orris, Greta J.",,"Magnesite, Gypsum-Anhydrite, Halite",,,,"Anhydrite, Clay, Gypsum, Halite, Magnesite",
23281,,,Folding.,Unknown,,EU,,,https://mrdata.usgs.gov/mrds/show-mrds.php?dep_id=10023801,,POINT (-1.49804 42.98243),,Producer,,,I001550,,"AGARD, J., AND EMBERGER, A., 1989, INTRODUCTION TO SOUTHWEST EUROPE, IN DUNNING, F.W., GARRARD, P., HASLAM, H.W., AND IXER, R.A., EDS., MINERAL DEPOSITS OF EUROPE VOLUME 4/5: SOUTHWEST AND EASTERN EUROPE, WITH ICELAND: LONDON, THE INSTITUTION OF MINING AND METALLURGY AND THE MINERALOGICAL SOCIETY, P. 1-36.HARBEN, P.W., AND BATES, R.L., 1990, INDUSTRIAL MINERALS AND WORLD DEPOSITS: LONDON, METAL BULLETIN PLC, 312 P.",,Eugui,M,Magnesite,Y,,,,C,"Slate,Limestone,Dolomite","Silica, Aluminum, Iron",,,"Wells, Tina M. (Orris, Greta J.)",,,,Magnesite,,,
24022,,,Contact Aureole Of Late Paleozoic Grandiorite,Unknown,,EU,,,https://mrdata.usgs.gov/mrds/show-mrds.php?dep_id=10024776,,POINT (-5.79813 40.54923),,Occurrence,,,ISM0528,,"SONDERMAYER,R.V., 1983, THE MINERAL INDUSTRY OF SPAIN, U.S. BUREAU OF MINES , MINERALS YEARBOOK 1983, P. 701.STAFF, MINING ACTIVITY DIGEST: EJMJ INTERNATIONAL DIRECTORY, VOL. 12, NO. 1 0, MARCH 21, 1986, P. 15.",,Los Santos,M,Tungsten,N,Endrinal Limestone,,,D,Limestone,,,,"Werner, Antony (Sinclair, W. David)",,,Guijuelo District,,Paleozoic Orogenic Belt,,
37902,,,,Unknown,,EU,Gravity; Some Pits In River Ran 2 To 3 Grams Pt/Cu/Meter - Others .5 To 2 Grams Pt/Cu/M. Highly Variable. Average Trace Pt To 3 Gr/Cu/M,,https://mrdata.usgs.gov/mrds/show-mrds.php?dep_id=10038928,,POINT (-4.9149 36.58267),,Producer,,,M046418,Placer,"DUPARC ET GROSS ET, 1916, ETUDE COMPAREE DES GITES DE RONDA ET DE L'OURAL: MEN. SOC. PHYS. ET HIST. NAT, DE GENEVE, V. 38, P. 273LIND, ET AL, 1923, PT ASSAYS AND PT PROMOTIONS: US BUR MINES REPT. INVESTIGATIONS, SER. 2496, P. 20",,Rio Verde,M,"Copper, Nickel",Y,,,,C,,"Platinum, Osmium, Iridium, Palladium, Chromium",,,"Blair, Will N.",STREAM GRAVELS,,Ronda,Chromite,,,
38034,,,,Unknown,,EU,,,https://mrdata.usgs.gov/mrds/show-mrds.php?dep_id=10039065,,POINT (-5.81486 38.0993),A French Chemist - Vauquelin,Producer,,,M046597,,"KEMP, 1902, PT AND ASSOC. METALS: USGS BULL. 193, P. 81O'NEILL AND GUNNING, 1934, PT AND ALLIED METAL DEPOSITS OF CANADA: CAN. GEOLOGICAL SURVEY, ECON. GEOL. SER. 13, P. 114",,Guadacanal,M,Silver,Y,,,,D,Schist,,,,"Blair, Will N.",,"Platinum, Copper, Lead",Guadacanal Silver Mine,Tetrahedrite,,,
